{
 "dataset": "scabench",
 "snapshot_date": "2025-08-18",
 "created_at": "2026-09-23T12:07:12.429929+00:00",
 "rows": [
  {
   "finding_id": "2024-10-coded-estate_H-01",
   "project": "code4rena_coded-estate-invitational_2024_12",
   "severity": "high",
   "class": "unmapped",
   "rule": "unmapped"
  },
  {
   "finding_id": "2024-10-coded-estate_H-02",
   "project": "code4rena_coded-estate-invitational_2024_12",
   "severity": "high",
   "class": "liveness",
   "rule": "halt"
  },
  {
   "finding_id": "2024-10-coded-estate_H-03",
   "project": "code4rena_coded-estate-invitational_2024_12",
   "severity": "high",
   "class": "unmapped",
   "rule": "unmapped"
  },
  {
   "finding_id": "2024-10-coded-estate_H-04",
   "project": "code4rena_coded-estate-invitational_2024_12",
   "severity": "high",
   "class": "unmapped",
   "rule": "unmapped"
  },
  {
   "finding_id": "2024-10-coded-estate_H-05",
   "project": "code4rena_coded-estate-invitational_2024_12",
   "severity": "high",
   "class": "unmapped",
   "rule": "unmapped"
  },
  {
   "finding_id": "2024-10-coded-estate_H-06",
   "project": "code4rena_coded-estate-invitational_2024_12",
   "severity": "high",
   "class": "unmapped",
   "rule": "unmapped"
  },
  {
   "finding_id": "2024-10-coded-estate_H-07",
   "project": "code4rena_coded-estate-invitational_2024_12",
   "severity": "high",
   "class": "unmapped",
   "rule": "unmapped"
  },
  {
   "finding_id": "2024-10-coded-estate_H-08",
   "project": "code4rena_coded-estate-invitational_2024_12",
   "severity": "high",
   "class": "unmapped",
   "rule": "unmapped"
  },
  {
   "finding_id": "2024-10-coded-estate_H-09",
   "project": "code4rena_coded-estate-invitational_2024_12",
   "severity": "high",
   "class": "liveness",
   "rule": "stuck"
  },
  {
   "finding_id": "2024-09-fenix-finance_H-01",
   "project": "code4rena_fenix-finance-invitational_2024_10",
   "severity": "high",
   "class": "upgrade-initializer",
   "rule": "upgrade"
  },
  {
   "finding_id": "2024-10-superposition_H-01",
   "project": "code4rena_superposition_2025_01",
   "severity": "high",
   "class": "upgrade-initializer",
   "rule": "initializ"
  },
  {
   "finding_id": "2024-10-superposition_H-02",
   "project": "code4rena_superposition_2025_01",
   "severity": "high",
   "class": "unmapped",
   "rule": "unmapped"
  },
  {
   "finding_id": "2024-10-superposition_H-03",
   "project": "code4rena_superposition_2025_01",
   "severity": "high",
   "class": "unmapped",
   "rule": "unmapped"
  },
  {
   "finding_id": "2024-12-lambowin_H-01",
   "project": "code4rena_lambowin_2025_02",
   "severity": "high",
   "class": "unmapped",
   "rule": "unmapped"
  },
  {
   "finding_id": "2024-12-lambowin_H-02",
   "project": "code4rena_lambowin_2025_02",
   "severity": "high",
   "class": "upgrade-initializer",
   "rule": "initializ"
  },
  {
   "finding_id": "2024-12-lambowin_H-03",
   "project": "code4rena_lambowin_2025_02",
   "severity": "high",
   "class": "unmapped",
   "rule": "unmapped"
  },
  {
   "finding_id": "2024-12-lambowin_H-04",
   "project": "code4rena_lambowin_2025_02",
   "severity": "high",
   "class": "access-control",
   "rule": "anyone can call"
  },
  {
   "finding_id": "2024-10-loopfi_H-01",
   "project": "code4rena_loopfi_2025_02",
   "severity": "high",
   "class": "precision-rounding",
   "rule": "rounding"
  },
  {
   "finding_id": "2024-10-loopfi_H-02",
   "project": "code4rena_loopfi_2025_02",
   "severity": "high",
   "class": "liquidation-logic",
   "rule": "bad debt"
  },
  {
   "finding_id": "2024-12-secondswap_H-01",
   "project": "code4rena_secondswap_2025_02",
   "severity": "high",
   "class": "upgrade-initializer",
   "rule": "initializ"
  },
  {
   "finding_id": "2024-12-secondswap_H-02",
   "project": "code4rena_secondswap_2025_02",
   "severity": "high",
   "class": "upgrade-initializer",
   "rule": "initializ"
  },
  {
   "finding_id": "2024-12-secondswap_H-03",
   "project": "code4rena_secondswap_2025_02",
   "severity": "high",
   "class": "upgrade-initializer",
   "rule": "initializ"
  },
  {
   "finding_id": "2024-12-bakerfi-invitational_H-01",
   "project": "code4rena_bakerfi-invitational_2025_02",
   "severity": "high",
   "class": "upgrade-initializer",
   "rule": "uninitialized"
  },
  {
   "finding_id": "2024-12-bakerfi-invitational_H-02",
   "project": "code4rena_bakerfi-invitational_2025_02",
   "severity": "high",
   "class": "access-control",
   "rule": "anyone can call"
  },
  {
   "finding_id": "2024-12-bakerfi-invitational_H-03",
   "project": "code4rena_bakerfi-invitational_2025_02",
   "severity": "high",
   "class": "unmapped",
   "rule": "unmapped"
  },
  {
   "finding_id": "2024-12-bakerfi-invitational_H-04",
   "project": "code4rena_bakerfi-invitational_2025_02",
   "severity": "high",
   "class": "flash-loan",
   "rule": "flash loan"
  },
  {
   "finding_id": "2024-12-bakerfi-invitational_H-05",
   "project": "code4rena_bakerfi-invitational_2025_02",
   "severity": "high",
   "class": "unmapped",
   "rule": "unmapped"
  },
  {
   "finding_id": "2024-12-bakerfi-invitational_H-06",
   "project": "code4rena_bakerfi-invitational_2025_02",
   "severity": "high",
   "class": "unmapped",
   "rule": "unmapped"
  },
  {
   "finding_id": "2024-12-bakerfi-invitational_H-07",
   "project": "code4rena_bakerfi-invitational_2025_02",
   "severity": "high",
   "class": "unmapped",
   "rule": "unmapped"
  },
  {
   "finding_id": "2025-01-pump-science_H-01",
   "project": "code4rena_pump-science_2025_02",
   "severity": "high",
   "class": "dos-griefing",
   "rule": "denial of service"
  },
  {
   "finding_id": "2025-01-pump-science_H-02",
   "project": "code4rena_pump-science_2025_02",
   "severity": "high",
   "class": "upgrade-initializer",
   "rule": "uninitialized"
  },
  {
   "finding_id": "2025-01-liquid-ron_H-01",
   "project": "code4rena_liquid-ron_2025_03",
   "severity": "high",
   "class": "unmapped",
   "rule": "unmapped"
  },
  {
   "finding_id": "2025-01-iq-ai_H-01",
   "project": "code4rena_iq-ai_2025_03",
   "severity": "high",
   "class": "unmapped",
   "rule": "unmapped"
  },
  {
   "finding_id": "2024-11-mantra-dex_H-01",
   "project": "code4rena_mantra-dex_2025_03",
   "severity": "high",
   "class": "unmapped",
   "rule": "unmapped"
  },
  {
   "finding_id": "2024-11-mantra-dex_H-02",
   "project": "code4rena_mantra-dex_2025_03",
   "severity": "high",
   "class": "unmapped",
   "rule": "unmapped"
  },
  {
   "finding_id": "2024-11-mantra-dex_H-03",
   "project": "code4rena_mantra-dex_2025_03",
   "severity": "high",
   "class": "unmapped",
   "rule": "unmapped"
  },
  {
   "finding_id": "2024-11-mantra-dex_H-04",
   "project": "code4rena_mantra-dex_2025_03",
   "severity": "high",
   "class": "unmapped",
   "rule": "unmapped"
  },
  {
   "finding_id": "2024-11-mantra-dex_H-05",
   "project": "code4rena_mantra-dex_2025_03",
   "severity": "high",
   "class": "unmapped",
   "rule": "unmapped"
  },
  {
   "finding_id": "2024-11-mantra-dex_H-06",
   "project": "code4rena_mantra-dex_2025_03",
   "severity": "high",
   "class": "unmapped",
   "rule": "unmapped"
  },
  {
   "finding_id": "2024-11-mantra-dex_H-07",
   "project": "code4rena_mantra-dex_2025_03",
   "severity": "high",
   "class": "unmapped",
   "rule": "unmapped"
  },
  {
   "finding_id": "2024-11-mantra-dex_H-08",
   "project": "code4rena_mantra-dex_2025_03",
   "severity": "high",
   "class": "unmapped",
   "rule": "unmapped"
  },
  {
   "finding_id": "2024-11-mantra-dex_H-09",
   "project": "code4rena_mantra-dex_2025_03",
   "severity": "high",
   "class": "dos-griefing",
   "rule": "denial of service"
  },
  {
   "finding_id": "2024-11-mantra-dex_H-10",
   "project": "code4rena_mantra-dex_2025_03",
   "severity": "high",
   "class": "unmapped",
   "rule": "unmapped"
  },
  {
   "finding_id": "2024-11-mantra-dex_H-11",
   "project": "code4rena_mantra-dex_2025_03",
   "severity": "high",
   "class": "unmapped",
   "rule": "unmapped"
  },
  {
   "finding_id": "2024-11-mantra-dex_H-12",
   "project": "code4rena_mantra-dex_2025_03",
   "severity": "high",
   "class": "unmapped",
   "rule": "unmapped"
  },
  {
   "finding_id": "2025-01-initia-move_H-01",
   "project": "code4rena_initia-move_2025_04",
   "severity": "high",
   "class": "oracle-manipulation",
   "rule": "price manipul"
  },
  {
   "finding_id": "2025-01-initia-move_H-02",
   "project": "code4rena_initia-move_2025_04",
   "severity": "high",
   "class": "upgrade-initializer",
   "rule": "initializ"
  },
  {
   "finding_id": "2025-01-initia-move_H-03",
   "project": "code4rena_initia-move_2025_04",
   "severity": "high",
   "class": "upgrade-initializer",
   "rule": "initializ"
  },
  {
   "finding_id": "2025-01-initia-move_H-04",
   "project": "code4rena_initia-move_2025_04",
   "severity": "high",
   "class": "unmapped",
   "rule": "unmapped"
  },
  {
   "finding_id": "2025-04-forte-float128-solidity-library_H-01",
   "project": "code4rena_forte-float128-solidity-library_2025_04",
   "severity": "high",
   "class": "unmapped",
   "rule": "unmapped"
  },
  {
   "finding_id": "2025-04-forte-float128-solidity-library_H-02",
   "project": "code4rena_forte-float128-solidity-library_2025_04",
   "severity": "high",
   "class": "unmapped",
   "rule": "unmapped"
  },
  {
   "finding_id": "2025-04-forte-float128-solidity-library_H-03",
   "project": "code4rena_forte-float128-solidity-library_2025_04",
   "severity": "high",
   "class": "unmapped",
   "rule": "unmapped"
  },
  {
   "finding_id": "2025-04-forte-float128-solidity-library_H-04",
   "project": "code4rena_forte-float128-solidity-library_2025_04",
   "severity": "high",
   "class": "unmapped",
   "rule": "unmapped"
  },
  {
   "finding_id": "2025-04-forte-float128-solidity-library_H-05",
   "project": "code4rena_forte-float128-solidity-library_2025_04",
   "severity": "high",
   "class": "precision-rounding",
   "rule": "precision loss"
  },
  {
   "finding_id": "2025-01-next-generation_H-01",